Date,Quote,Significance,Central Banker,geo,Source..link,Stance,Position,Voter,Scale value,Active
2025-05-12T00:00:00Z,If that inflation in Europe remains close to 2% — and at the moment we see that the tendency is to converge to around 2% — then gradual cautious reductions can follow.,NA,Mārtiņš Kazāks,ECB,NA,Centrist,"Governor, national central bank",NA,50,NA
2025-05-10T00:00:00Z,"The appropriate course of action is to keep rates close to where they are today – that is, firmly in neutral territory.","Schnabel argues that the ECB should not reduce rates further, indicating her lack of support for a June cut.",Isabel Schnabel,ECB,Keeping a steady hand in an unsteady world,Hawkish,"Member, executive board",Yes,75,Yes
2025-05-09T00:00:00Z,"The appropriate course of action is to keep rates close to where they are today – that is, firmly in neutral territory.","Schnabel argues that the ECB should not reduce rates further, indicating her lack of support for a June cut.",Isabel Schnabel,ECB,NA,Hawkish,"Member, executive board",NA,25,NA
2025-05-09T00:00:00Z,"Against this background of disinflation on track and growth having weakened, in case this is going to be confirmed in our June forecast, then in my view in order to achieve our 2% symmetric inflation target over the medium term, the right reaction in monetary policy is to cut rates.",Rehn openly indicates that he is supportive of easing in June.,Olli Rehn,ECB,NA,Dovish,"Governor, national central bank",NA,25,NA
2025-05-09T00:00:00Z,For me the June decision is quite clear [...] chances that there might be another cut after June.,NA,Gediminas Šimkus,ECB,NA,Dovish,"Governor, national central bank",NA,25,NA
2025-05-05T00:00:00Z,It seems we will continue. But we have said that the approach that will apply is that at each meeting we will see the data and decide.,Stournaras suggests that the ECB will continue to cut sequentially.,Yannis Stournaras,ECB,NA,Dovish,"Governor, national central bank",NA,25,NA
2025-05-02T00:00:00Z,Our baseline scenario continues to assume very low but positive growth – clearly below potential growth. But I don’t believe that the eurozone will fall into recession.,NA,Luis de Guindos,ECB,NA,Centrist,Vice president,NA,50,NA
2025-04-29T00:00:00Z,The recent increase in trade policy uncertainty could reduce euro area business investment by 1.1% in the first year and real GDP growth by around 0.2 percentage points in 2025-26.,Cipollone argues that the trade war will have disinflationary effects on the Eurozone economy.,Piero Cipollone,ECB,NA,Dovish,"Member, executive board",NA,25,NA
2025-04-28T00:00:00Z,Our objective with the ECB is around 2% inflation. We are almost there at 2.2% and should meet the objective. And that means something important: we still have a gradual margin for interest rate cuts.,NA,François Villeroy de Galhau,ECB,NA,Dovish,"Governor, national central bank",NA,25,NA
2025-04-28T00:00:00Z,"I think it is important that we do not let any thresholds, such as an estimated neutral rate, constrain us. This is a time for agile and active monetary policy.",Rehn indicates that he would be supportive of very substantial additional cuts.,Olli Rehn,ECB,NA,Dovish,"Governor, national central bank",NA,25,NA
2025-04-28T00:00:00Z,But the ECB looks at inflation risks in the middle to long term. In the longer term inflation risks are definitely two-sided. I think the June meeting will be really complex.,NA,Klaas Knot,ECB,NA,Centrist,"Governor, national central bank",NA,50,NA
2025-04-27T00:00:00Z,"We are at 2.25% — the question is more about whether we will have to go much lower below 2%,” he said. “We’ll do it if we have to, but the economic picture would have to become much weaker for that to happen and to weigh down on inflation further.",NA,Mārtiņš Kazāks,ECB,NA,Centrist,"Governor, national central bank",NA,50,NA
2025-04-26T00:00:00Z,"“With data at hand, I can’t exclude two more cuts to come this year. But in order to go further, we’d need to see more negative surprises.",NA,Gediminas Šimkus,ECB,NA,Dovish,"Governor, national central bank",NA,25,NA
2025-04-25T00:00:00Z,"There is a markdown, but it is important to say it is a markdown to a little bit less.",Lane indicates that he does not fear a recession in the Eurozone.,Philip Lane,ECB,NA,Centrist,"Member, executive board",NA,50,NA
2025-04-25T00:00:00Z,"I agree with President Christine Lagarde that so far, the net impact from the US tariff announcements seems to be rather deflationary than inflationary.","Holzmann, one of the ECB's most hawkish governing council members, indicates that he views the risks from tariffs as disinflationary, suggesting the likely need for further cuts.",Robert Holzmann,ECB,NA,Dovish,"Governor, national central bank",NA,25,NA
2025-04-24T00:00:00Z,"It is therefore both fair and appropriate that, compared to the Federal Reserve or the Bank of England, the ECB has started cutting rates earlier, faster, and likely further this year.",NA,François Villeroy de Galhau,ECB,NA,Dovish,"Governor, national central bank",NA,25,NA
2025-04-24T00:00:00Z,We are relatively certain that the impact on inflation in the U.S. will be stronger than in the euro zone.,NA,Joachim Nagel,ECB,NA,Dovish,"Governor, national central bank",NA,25,NA
2025-04-23T00:00:00Z,I'm confident that ECB rates will get back down to 2% this year,NA,Joachim Nagel,ECB,NA,Dovish,"Governor, national central bank",NA,25,NA
2025-04-23T00:00:00Z,There’s also a possibility that one would need to be a bit more accommodative with monetary policy. But there’s also a fair possibility that it’ll not be the case. It is just too early to tell.,NA,Madis Müller,ECB,NA,Dovish,"Governor, national central bank",NA,25,NA
2025-04-23T00:00:00Z,"Particularly if there is no countermeasures decided by Europe, I think the net inflation is uncertain at the moment, but probably it’s going to be disinflationary more than inflationary.",Lagarde suggests that the net effect of tariffs on the European economy warrants a dovish response at the margin.,Christine Lagarde,ECB,NA,Dovish,President,NA,25,NA
2025-04-22T00:00:00Z,We're heading to target [inflation] over course of 2025,NA,Christine Lagarde,ECB,NA,Dovish,President,NA,25,NA
2025-04-22T00:00:00Z,Downside risks to growth are materialising,NA,Luis de Guindos,ECB,NA,Dovish,Vice president,NA,25,NA
2025-04-22T00:00:00Z,US tariffs will push euro-area inflation down in the short term,NA,Olli Rehn,ECB,NA,Dovish,"Governor, national central bank",NA,25,NA
2025-04-22T00:00:00Z,"Inflation is approaching its target, and I am confident that we will reach it within the next few months",NA,Peter Kažimír,ECB,NA,Dovish,"Governor, national central bank",NA,25,NA
2025-04-22T00:00:00Z,"Inflation is approaching its target, and I am confident that we will reach it within the next few months. However, we remain cautious. We must, particularly under today’s volatile and often chaotic conditions. We must remain vigilant and agile.",NA,Peter Kažimír,ECB,NA,Dovish,"Governor, national central bank",NA,25,NA
2025-04-21T00:00:00Z,Tariff war is adding economic risks,NA,Mārtiņš Kazāks,ECB,NA,Dovish,"Governor, national central bank",NA,25,NA
2025-04-18T00:00:00Z,Policy rates are no longer a constraint on the Eurozone's economic activity,NA,Madis Müller,ECB,NA,Hawkish,"Governor, national central bank",NA,75,NA
2025-04-18T00:00:00Z,Inflation risk from trade tensions seems weak and could even be downward,NA,François Villeroy de Galhau,ECB,NA,Dovish,"Governor, national central bank",NA,25,NA
2025-04-17T00:00:00Z,"Must be agile, attentive to new shocks",NA,Christine Lagarde,ECB,NA,Dovish,President,NA,25,NA
2025-04-09T00:00:00Z,"For the time being, I don’t see a reason for a cut. As a strategy, waiting dominates alternatives in both directions.",NA,Robert Holzmann,ECB,NA,Hawk,"Governor, national central bank",NA,100,NA
2025-04-09T00:00:00Z,"[There's a risk] of a combination of a negative supply shock and a positive demand shock, this time because of fiscal policy. And that means we have to be really vigilant.",Knot sees inflationary risks in the medium term from the combination of looser fiscal policies and the effect of tariffs.,Klaas Knot,ECB,NA,Hawkish,"Governor, national central bank",NA,75,NA
2025-04-09T00:00:00Z,"Based on the overall assessment of inflation and growth, I believe the case for further rate cuts at the April meeting has clearly strengthened.",NA,Olli Rehn,ECB,NA,Dovish,"Governor, national central bank",NA,25,NA
2025-04-09T00:00:00Z,"There’s still room to cut rates, which we must decide on using agile pragmatism. The changes since April 2 indeed make the case for a cut soon.",Villeroy indicates that tariffs bolster the case for further easing.,François Villeroy de Galhau,ECB,NA,Dovish,"Governor, national central bank",NA,25,NA
2025-04-08T00:00:00Z,"Any further resurgence in inflation or inflation expectations could delay or even halt the process of monetary policy normalization, worsening financial conditions and growth momentum.","Stournaras, normally a dove, gives a hawkish interpretation of the likely impact of tariffs for the European economy.",Yannis Stournaras,ECB,NA,Hawkish,"Governor, national central bank",NA,75,NA
2025-04-08T00:00:00Z,"I still think that we should cut rates in April, and then, with a lot more information in June — hopefully including more clarity on tariffs and other things — we can think about whether we should wait and see or cut again.",Simkus believes that tariffs create an impulse for additional ECB easing.,Gediminas Šimkus,ECB,NA,Dovish,"Governor, national central bank",NA,25,NA
2025-04-08T00:00:00Z,Global growth prospects have deteriorated massively. Monetary policy in Europe will do its part ... We are already well on our way to achieving our inflation target this year.,NA,Joachim Nagel,ECB,NA,Centrist,"Governor, national central bank",NA,50,NA
2025-04-03T00:00:00Z,Trump’s tariffs shouldn’t significantly change this European disinflation story.,NA,François Villeroy de Galhau,ECB,NA,Centrist,"Governor, national central bank",NA,50,NA
2025-04-02T00:00:00Z,"We are now very close to target, so the disinflationary process is well underway. There’s still a bit of work to do, but we are really quite satisfied with the work that we have done.",NA,Christine Lagarde,ECB,NA,Centrist,President,NA,50,NA
2025-04-02T00:00:00Z,"We had assumed inflation would come down. As we are neutral and inflation is converging to target, there is no reason to become accommodative.",NA,Robert Holzmann,ECB,NA,Hawkish,"Governor, national central bank",NA,75,NA
2025-04-01T00:00:00Z,"If the data verify the baseline and indicate that to reach our goal of 2% symmetric inflation target over the medium term, the right reaction in monetary policy should be to cut in April, we should indeed do so.",Rehn gives a clear indication of support for easing in April.,Olli Rehn,ECB,NA,Dovish,"Governor, national central bank",NA,25,NA
2025-03-31T00:00:00Z,"Looking ahead, we can’t yet say that the battle against inflation is over.",NA,Fabio Panetta,ECB,NA,Centrist,"Governor, national central bank",NA,50,NA
2025-03-28T00:00:00Z,"The latest figures I’ve seen regarding inflation in individual countries are encouraging.. But often, when the goal is within reach, you tend to become overly optimistic. And I would almost like to warn against that.",NA,Joachim Nagel,ECB,NA,Hawkish,"Governor, national central bank",NA,75,NA
2025-03-27T00:00:00Z,"I’m not saying I’m pleading for a pause in April, but it’s certainly something that should be on the table.",NA,Pierre Wunsch,ECB,NA,Hawkish,"Governor, national central bank",NA,75,NA
2025-03-27T00:00:00Z,"Today it’s very difficult to say what we’re going to do in April. We’ll see the data, we’ll see how the different elements are evolving. I hope that we’ll have more clarity with respect to the final outcome in terms of tariffs. And then we will decide accordingly.",NA,Luis de Guindos,ECB,NA,Centrist,Vice president,NA,50,NA
2025-03-26T00:00:00Z,There is a need to be cautious in reducing the interest rate too much.,NA,Robert Holzmann,ECB,NA,Hawkish,"Governor, national central bank",NA,75,NA
2025-03-25T00:00:00Z,"Seen from today, markets expect an ECB interest rate of around 2% in the summer. It is a possible scenario, considering that summer in Europe lasts from June till September.","Villeroy casts some doubt on the probability of a fast easing cycle, indicating that rate cuts could be spread over the next six months.",François Villeroy de Galhau,ECB,NA,Centrist,"Governor, national central bank",NA,50,NA
2025-03-24T00:00:00Z,"We do need to be cautious about changes to our monetary policy stance where we're not yet at (inflation) target, and when quite exceptional events are happening around the world which could have a direct effect on inflation.",NA,Gabriel Makhlouf,ECB,NA,Hawkish,"Governor, national central bank",NA,75,NA
2025-03-24T00:00:00Z,The more disruptive scenarios aren’t materializing.That doesn’t mean they couldn’t take us by surprise. We need to be readier than ever to revise our forecasts.,NA,José Luis Escrivá,ECB,NA,Centrist,"Governor, national central bank",NA,50,NA
2025-03-24T00:00:00Z,"At the time of our March meeting, markets were pricing in a reduction in interest rates over the coming months, including going below 2%. Since then, not only has this narrative been confirmed, but key issues have arisen that have strengthened the arguments in favor of continuing to lower rates.",Cipollone reinforces the case for another cut in April.,Piero Cipollone,ECB,NA,Dovish,"Member, executive board",NA,25,NA
2025-03-21T00:00:00Z,"Everything points in the direction of a cut in April [...] But this is not April. It is still March. We have one month to go, so I cannot tell you that we're going to cut.",NA,Yannis Stournaras,ECB,NA,Dovish,"Governor, national central bank",NA,25,NA
2025-03-21T00:00:00Z,"Everything points in the direction of a cut in April. But this is not April. It is still March. We have one month to go, so I cannot tell you that we’re going to cut.","Stournaras, one of the ECB's most dovish members, says he is not sure about the merits of an April cut. This casts doubt on the extent of support for the move.",Yannis Stournaras,ECB,NA,Centrist,"Governor, national central bank",NA,50,NA
2025-03-20T00:00:00Z,"When we think of in which direction for example the tariffs or counter-tariffs imposed by the EU on American goods might have an impact on the economy, it would weaken the economy [...] but also it would probably drive logically prices a bit higher, so there’s a bit of upside risk for inflation.",NA,Madis Müller,ECB,NA,Hawkish,"Governor, national central bank",NA,75,NA
2025-03-20T00:00:00Z,"I remain open-minded [about an April rate cut], but we do have to think it through, and there is time for that, but there is still too much unfamiliarity in that area.","Knot, normally a hawk, says the door is still open to easing next month if the data allows.",Klaas Knot,ECB,NA,Centrist,"Governor, national central bank",NA,50,NA
2025-03-20T00:00:00Z,"Especially in current conditions of rising uncertainty, we will follow a data-dependent and meeting-by-meeting approach to determining the appropriate monetary-policy stance.","Lagarde gives few hints about the pace of the rest of the ECB's cutting cycle, maximizing the central bank's room for manoeuvre.",Christine Lagarde,ECB,NA,Centrist,President,NA,50,NA
2025-03-20T00:00:00Z,Probably the ECB still has margin for rate cuts. We’ll see at what pace in this uncertain environment.,NA,François Villeroy de Galhau,ECB,NA,Centrist,"Governor, national central bank",NA,50,NA
2025-03-19T00:00:00Z,"We will go from meeting to meeting depending on the data, and we don’t have any predetermined path for the evolution of interest rates in the coming months.",NA,Luis de Guindos,ECB,NA,Centrist,Vice president,NA,50,NA
2025-03-18T00:00:00Z,"The governing council wants to retain full freedom of action, especially in our current times of pervasive uncertainty.",NA,Olli Rehn,ECB,NA,Centrist,"Governor, national central bank",NA,50,NA
2025-03-17T00:00:00Z,[Inflation] will move to lower levels and that is the fundamental element we use to say that inflation will converge toward 2% and that we will reach our price stability target,NA,Luis de Guindos,ECB,NA,Centrist,Vice president,NA,50,NA
2025-03-14T00:00:00Z,I am in favour of a possible interest rate pause in April.,NA,Robert Holzmann,ECB,NA,Hawkish,"Governor, national central bank",NA,75,NA
2025-03-14T00:00:00Z,"The uncertainty means that the probability of other scenarios is not that far apart, and that would potentially shift the rate path.",NA,Mārtiņš Kazāks,ECB,NA,Centrist,"Governor, national central bank",NA,25,NA
2025-03-14T00:00:00Z,"I would say that, if anything, what’s coming from these trade policies from the United States is uncertainty, extreme uncertainty. In principle, they’re inflationary, but at the same they might impact negatively on demand, on confidence.","Escriva emphasizes that the risks to the current policy environment for the ECB's rate path are two-sided, not one-sided.",José Luis Escrivá,ECB,NA,Centrist,"Deputy governor, national central bank",NA,50,NA
2025-03-12T00:00:00Z,"Trade fragmentation and higher defense spending in a capacity-constrained sector could in principle push up inflation. Yet US tariffs could also lower demand for EU exports and redirect excess capacity from China into Europe, which could push inflation down.","Lagarde suggests that the impact of the Trump administration's policies on the ECB's rate path is ambiguous, reinforcing that the ECB will take a data-dependent approach to the rate cycle in the months ahead.",Christine Lagarde,ECB,NA,Centrist,President,NA,50,NA
2025-03-10T00:00:00Z,[It's] clear that we’re not moving on autopilot.,NA,Joachim Nagel,ECB,NA,Hawkish,"Governor, national central bank",NA,75,NA
2025-03-10T00:00:00Z,"Over the coming weeks, we must carefully assess all the incoming data and complement what we learn with cautious judgment...despite encouraging inflation trends, I am still looking for undeniable confirmation that disinflation will stay.",NA,Peter Kažimír,ECB,NA,Hawkish,"Governor, national central bank",NA,75,NA
2025-03-08T00:00:00Z,The risk that inflation will remain above 2% longer than expected is higher than the risk that it falls sustainably below 2%.,Schnabel reiterates that she sees hawkish risks to the Eurozone's inflation outlook.,Isabel Schnabel,ECB,NA,Hawkish,"Member, executive board",NA,75,NA
2025-03-07T00:00:00Z,Let’s keep an open mind. It’s impossible to prejudge the April decision because we need to see what those alternative scenarios or shocks are going to look like.,"Kazaks, a hawk, keeps the door open to a cut in April.",Mārtiņš Kazāks,ECB,NA,Dovish,"Governor, national central bank",NA,25,NA
2025-03-07T00:00:00Z,We are in process of reaching that target in the medium term in a stable way.,NA,Mario Centeno,ECB,NA,Dovish,"Governor, national central bank",NA,25,NA
2025-03-07T00:00:00Z,We need to be ready to act and react fast as we have done since last June.,NA,François Villeroy de Galhau,ECB,NA,Dovish,"Governor, national central bank",NA,25,NA
2025-03-06T00:00:00Z,"High uncertainty, both at home and abroad, is holding back investment and competitiveness challenges are weighing on exports...an increase in defence and infrastructure spending could also add to growth.",NA,Christine Lagarde,ECB,NA,Centrist,President,NA,50,NA
2025-02-26T00:00:00Z,I don’t think that our next meeting is the right moment to discuss pausing.,NA,Yannis Stournaras,ECB,NA,Dovish,"Governor, national central bank",NA,25,NA
2025-02-25T00:00:00Z,"In view of the latest developments on the inflation front, and given the high level of uncertainty, it’s wise to take one step at a time in terms of monetary policy. And not to rush into further interest-rate cuts.",NA,Joachim Nagel,ECB,NA,Hawkish,"Governor, national central bank",NA,75,NA
2025-02-25T00:00:00Z,The fact that growth remains subdued cannot and should not be taken as evidence that policy is restrictive.,NA,Isabel Schnabel,ECB,NA,Hawkish,"Member, executive board",NA,75,NA
2025-02-24T00:00:00Z,"I'm not pleading for a pause in April but we must not sleepwalk to 2% (interest rates) without thinking about it. If the data justify a new cut, we'll cut. If they don't, we might have to pause.",NA,Pierre Wunsch,ECB,NA,Hawkish,"Governor, national central bank",NA,75,NA
2025-02-23T00:00:00Z,"It’s advisable to be cautious, especially from the point of view of monetary policy; wait for doubts around certain issues to be cleared, see how the different geopolitical dynamics are resolved.",NA,José Luis Escrivá,ECB,NA,Hawkish,"Deputy governor, national central bank",NA,75,NA
2025-02-22T00:00:00Z,"Seen from where we are today, we could be at 2% by the coming summer.","Villeroy indicates his support for an extended, accelerated pace of easing.",François Villeroy de Galhau,ECB,NA,Dovish,"Governor, national central bank",NA,25,NA
2025-02-20T00:00:00Z,"a decision in favor of another cut gets harder and harder, both now and beyond March.",NA,Robert Holzmann,ECB,NA,Hawkish,"Governor, national central bank",NA,75,NA
2025-02-20T00:00:00Z,We are getting closer to the point where we may have to pause or halt our rate cuts.,Schnabel signals that there is a constituency on the governing council in favour of a near-term pause in the easing cycle.,Isabel Schnabel,ECB,NA,Hawk,"Member, executive board",NA,100,NA
2025-02-20T00:00:00Z,"Needless to say, the disinflation process remains subject to risks, and there is a very high degree of uncertainty surrounding the outlook.",NA,Gabriel Makhlouf,ECB,NA,Hawkish,"Governor, national central bank",NA,75,NA
2025-02-20T00:00:00Z,A less decisive easing of monetary policy could lead to excessively low inflation in the medium term.,NA,Fabio Panetta,ECB,NA,Dovish,"Governor, national central bank",NA,25,NA
2025-02-20T00:00:00Z,"To strike the right balance, we should ensure that our rate decisions adequately compensate for the tightening induced by the reduction of our balance sheet.","Cipollone suggests that QT could justify a faster pace of easing, since it raises yields at the margin.",Piero Cipollone,ECB,NA,Dovish,"Member, executive board",NA,25,NA
2025-02-18T00:00:00Z,"To strike the right balance, we should ensure that our rate decisions adequately compensate for the tightening induced by the reduction of our balance sheet.","Cipollone suggests that QT could justify a faster pace of easing, since it raises yields at the margin.",Piero Cipollone,ECB,Striking the right balance: the ECB’s balance sheet and its implications for monetary policy,Dovish,"Member, executive board",Yes,25,Yes
2025-02-15T00:00:00Z,"Overall, the available indicators seem to suggest that the predominant risk remains inflation falling below 2% over the medium term.",NA,Fabio Panetta,ECB,NA,Centrist,"Governor, national central bank",NA,NA,NA
2025-02-13T00:00:00Z,The market is pricing three more rate cuts this year. Those expectations are not unreasonable.,NA,Boris Vujčić,ECB,NA,Centrist,"Governor, national central bank",NA,NA,NA
2025-02-12T00:00:00Z,[The neutral rate is] not such a good guide to short-term policy decisions.,NA,Frank Elderson,ECB,NA,Centrist,"Member, executive board",NA,NA,NA
2025-02-12T00:00:00Z,"The closer we get to the neutral rate, the more appropriate it becomes to take a gradual approach [...] there is no reason to act hastily in the present uncertain environment.",Nagel supports a gradual approach to additional easing.,Joachim Nagel,ECB,NA,Centrist,"Governor, national central bank",NA,NA,NA
2025-02-10T00:00:00Z,The disinflation process in the euro area is well on track... greater friction in global trade would make the euro area inflation outlook more uncertain.,NA,Christine Lagarde,ECB,NA,Centrist,President,NA,NA,NA
2025-02-06T00:00:00Z,"I don’t want to seem elusive, but the uncertainty is so high that anything can happen. We all agree there is still room for adjusting rates downwards. But we need to be extremely careful.","Cipollone refuses to give clear indications about the ECB's next moves, suggesting that the governing council does not yet have a firm idea of the decision it will take in March.",Piero Cipollone,ECB,NA,Centrist,"Member, executive board",NA,NA,NA
2025-02-05T00:00:00Z,We may need to go below neutral...Our economy is not strong enough to support inflation at 2%.,NA,Mario Centeno,ECB,NA,Dovish,"Governor, national central bank",NA,NA,NA
2025-02-05T00:00:00Z,"Balancing these considerations suggest a middle path is appropriate, which neither over-weighs upside risk nor over-weighs downside risk.","Lane reiterates that the ECB will continue taking a data-dependent approach, as high uncertainty prevents it from committing to a particular rate path ahead of time especially as the next rate-setting meeting is several weeks away.",Philip Lane,ECB,NA,Centrist,"Member, executive board",NA,NA,NA
2025-02-04T00:00:00Z,"Once we reach the roughly neutral level, we can then decide should we stay or should we go. That is, we can then judge whether we should stay at neutral or we should move further to the stimulative territory — that depends on the economic outlook when the times comes when we will have to decide the matter.","Rehn is open to the idea of taking rates to an accommodative level, and that he believes further restriction is no longer needed.",Olli Rehn,ECB,NA,Dovish,"Governor, national central bank",NA,NA,NA
2025-02-04T00:00:00Z,As you know we started cutting rates last June and we decided on the fifth cut last week and there will probably be more.,NA,François Villeroy de Galhau,ECB,NA,Centrist,"Governor, national central bank",NA,NA,NA
